{
  "schema_version": 1,
  "id": "observation-profile-fixture",
  "workspace_id": "workspace-fixture",
  "case_id": "case-fixture",
  "revision_id": "revision-1",
  "template": "checkout_receipt_v1",
  "success_locator": {
    "kind": "test_id",
    "value": "checkout-status"
  },
  "receipt": {
    "path_template": "/__faultline/receipts/{attempt_id}",
    "method": "GET",
    "credential_ref": null,
    "completed_pointer": "/completed",
    "order_count_pointer": "/order_count",
    "error_code_pointer": "/error_code",
    "max_response_bytes": 4096
  },
  "incident_error_code": "PAY_BUTTON_HANDLER_MISSING",
  "symptom_evidence_ids": [
    "evidence-1"
  ],
  "sandbox_only": true,
  "created_at": "2026-10-09T12:00:00.000Z",
  "reviewed_by": "fixture-reviewer",
  "profile_hash": "72c89299a092ae1d33acce778626fbe0767889755ba64e24b2efefa158acb688"
}
